{
  "version": 1,
  "source": "backlog/frontier.md",
  "source_sha": "1111111111111111111111111111111111111111",
  "items": [
    {
      "id": "TASK-001",
      "status": "active",
      "depends_on": [],
      "objective": "Document approved session response behavior",
      "acceptance": [
        "Expired and malformed credentials return 401 in the documentation.",
        "Expiry precedes lookup; valid credentials continue normally.",
        "No inaccessible resource existence is leaked.",
        "Whitespace check and independent wording review."
      ],
      "detail": "backlog/items/TASK-001.md",
      "lane": "offline"
    }
  ]
}
